{
  "provenanceId": "01a10760-b9f0-7cec-baf3-a137119256cb",
  "subjectType": "CLASSIFICATION",
  "subjectId": "01a10760-b9f0-782d-947b-5cd2a51ad957",
  "fieldPath": "classification.valueCode",
  "sourceType": "OWNER_REVIEW",
  "sourceName": "VocabFlow Hybrid 100-Sense CEFR Full Owner Review",
  "authoredBy": "VocabFlow project owner",
  "notes": "Owner accepted the VocabFlow editorial CEFR estimate under CEFR / EDITORIAL-PILOT-1 for canonical DRAFT promotion review. This is an owner review record, not an official CEFR classification and not a claim of source approval, source license, or external authority.",
  "createdAt": "2026-10-04T14:45:42Z"
}
