{
  "provenanceId": "01a0fc13-09ef-7eba-a757-af13b736f361",
  "subjectType": "LINGUISTIC_CHILD",
  "subjectId": "01a0fc13-09ef-770f-bd08-bd01d6dbf9f4",
  "fieldPath": "example.exampleTranslations",
  "sourceType": "PROJECT_AUTHORED",
  "sourceName": "VocabFlow Master Vocabulary V2 Phase 2B pilot",
  "authoredBy": "VocabFlow project",
  "notes": "Project-authored Vietnamese example translation retained as a draft.",
  "createdAt": "2026-10-02T00:00:00Z"
}
