{
  "provenanceId": "01a0fc13-09ef-7271-9b3e-205423a99747",
  "subjectType": "LINGUISTIC_CHILD",
  "subjectId": "01a0fc13-09ef-7a49-b8e0-da02e355a6c8",
  "fieldPath": "sense.examples",
  "sourceType": "PROJECT_AUTHORED",
  "sourceName": "VocabFlow Master Vocabulary V2 Phase 2B pilot",
  "authoredBy": "VocabFlow project",
  "notes": "Project-authored English example for this Sense retained as a draft for editorial review.",
  "createdAt": "2026-10-02T00:00:00Z"
}
