{
  "provenanceId": "01a0fc13-09ee-7b27-b9ce-62ae6e24623d",
  "subjectType": "LINGUISTIC_CHILD",
  "subjectId": "01a0fc13-09ee-760e-9e41-e22d5882f389",
  "fieldPath": "sense.translations",
  "sourceType": "PROJECT_AUTHORED",
  "sourceName": "VocabFlow Master Vocabulary V2 Phase 2B pilot",
  "authoredBy": "VocabFlow project",
  "notes": "Project-authored Vietnamese Sense translation retained as a draft for owner review.",
  "createdAt": "2026-10-02T00:00:00Z"
}
