{
  "provenanceId": "01a0fc13-09f1-785c-a734-cbcaf0f69657",
  "subjectType": "CLASSIFICATION",
  "subjectId": "01a0fc13-09f1-77db-a129-a90f7b5ab670",
  "fieldPath": "classification",
  "sourceType": "PROJECT_AUTHORED",
  "sourceName": "VocabFlow Master Vocabulary V2 Phase 2B pilot",
  "authoredBy": "VocabFlow project",
  "notes": "Unverified editorial estimate for architecture testing only; no official CEFR vocabulary-list alignment is claimed.",
  "createdAt": "2026-10-02T00:00:00Z"
}
