{
  "provenanceId": "01a0fc13-09f1-7fc0-93ca-732169e0dc33",
  "subjectType": "CLASSIFICATION",
  "subjectId": "01a0fc13-09f1-7c6e-9ee6-5bc6b86fdef4",
  "fieldPath": "classification",
  "sourceType": "PROJECT_AUTHORED",
  "sourceName": "VocabFlow Master Vocabulary V2 Phase 2B pilot",
  "authoredBy": "VocabFlow project",
  "notes": "Editorial Domain assignment; GENERAL_ENGLISH is used only where broad general usage is useful.",
  "createdAt": "2026-10-02T00:00:00Z"
}
