{
  "provenanceId": "01a10760-b9f0-7c83-aa6f-b75f91a8294c",
  "subjectType": "CLASSIFICATION",
  "subjectId": "01a10760-b9f0-7ab3-baf5-00d42cb0a66d",
  "fieldPath": "classification.valueCode",
  "sourceType": "PROJECT_AUTHORED",
  "sourceName": "VocabFlow Hybrid 100-Sense CEFR Editorial Review",
  "authoredBy": "VocabFlow project",
  "notes": "VocabFlow editorial CEFR estimate under CEFR/EDITORIAL-PILOT-1. External APKG labels were used only as local review evidence and are not represented as official or licensed classification claims.",
  "createdAt": "2026-10-04T14:45:42Z"
}
