{
  "provenanceId": "01a10760-b9f0-7c42-9f46-8b3f27fac63d",
  "subjectType": "SENSE",
  "subjectId": "01a1070c-7c5a-7542-a093-116a29fa3a72",
  "fieldPath": "sense.editorialDecision",
  "sourceType": "OWNER_REVIEW",
  "sourceName": "VocabFlow Hybrid 100-Sense Owner Review",
  "authoredBy": "VocabFlow project owner",
  "notes": "Owner approved candidate SOURCE-CANDIDATE-feb4f8b9a7b535c16ba72278e5323ead94f582a660d9d5b2c03d00643efe0155 for canonical DRAFT promotion only; this does not approve learner-facing content for release.",
  "createdAt": "2026-10-04T14:45:42Z"
}
