{
  "provenanceId": "01a10760-b9f0-7d9e-8fd3-fb0cd528b003",
  "subjectType": "SENSE",
  "subjectId": "01a1070c-7c57-7676-9acf-fbb6c07854f6",
  "fieldPath": "sense",
  "sourceType": "PROJECT_AUTHORED",
  "sourceName": "VocabFlow Hybrid 100-Sense Editorial Authoring",
  "authoredBy": "VocabFlow project",
  "notes": "Project-authored during the owner-reviewed hybrid 100-Sense proof; external APKG sources were used only as local semantic reference and their text was not reused.",
  "createdAt": "2026-10-04T14:45:42Z"
}
