{
  "provenanceId": "01a0fc13-09ed-7edb-8c60-f19069e0f459",
  "subjectType": "LINGUISTIC_CHILD",
  "subjectId": "01a0fc13-09ed-74f7-88ba-a0f8187dc38b",
  "fieldPath": "sense.translations",
  "sourceType": "PROJECT_AUTHORED",
  "sourceName": "VocabFlow Master Vocabulary V2 Phase 2B pilot",
  "authoredBy": "VocabFlow project",
  "notes": "Project-authored Vietnamese Sense translation retained as a draft for owner review.",
  "createdAt": "2026-10-02T00:00:00Z"
}
