{
  "provenanceId": "01a10760-b9f0-7390-a282-0620e420fcf5",
  "subjectType": "SENSE",
  "subjectId": "01a1070c-7c58-76b5-a2ab-48eb58f50cbf",
  "fieldPath": "sense",
  "sourceType": "PROJECT_AUTHORED",
  "sourceName": "VocabFlow Hybrid 100-Sense Editorial Authoring",
  "authoredBy": "VocabFlow project",
  "notes": "Project-authored during the owner-reviewed hybrid 100-Sense proof; external APKG sources were used only as local semantic reference and their text was not reused.",
  "createdAt": "2026-10-04T14:45:42Z"
}
