{
  "provenanceId": "01a10760-b9f0-7443-926c-3e3cec32c7f1",
  "subjectType": "LINGUISTIC_CHILD",
  "subjectId": "01a1070c-7c59-726e-88d6-ac264da27a07",
  "fieldPath": "example.exampleTranslations",
  "sourceType": "PROJECT_AUTHORED",
  "sourceName": "VocabFlow Hybrid 100-Sense Editorial Authoring",
  "authoredBy": "VocabFlow project",
  "notes": "Project-authored during the owner-reviewed hybrid 100-Sense proof; external APKG sources were used only as local semantic reference and their text was not reused.",
  "createdAt": "2026-10-04T14:45:42Z"
}
