{
  "provenanceId": "01a10760-b9f0-7d2f-8145-b0c83a046296",
  "subjectType": "CLASSIFICATION",
  "subjectId": "01a10760-b9f0-7441-90c0-8ef7353df869",
  "fieldPath": "classification.valueCode",
  "sourceType": "PROJECT_AUTHORED",
  "sourceName": "VocabFlow Hybrid 100-Sense CEFR Editorial Review",
  "authoredBy": "VocabFlow project",
  "notes": "VocabFlow editorial CEFR estimate under CEFR/EDITORIAL-PILOT-1. External APKG labels were used only as local review evidence and are not represented as official or licensed classification claims.",
  "createdAt": "2026-10-04T14:45:42Z"
}
