{
  "provenanceId": "01a10760-b9f0-7293-82d8-efc73beedd31",
  "subjectType": "LINGUISTIC_CHILD",
  "subjectId": "01a1070c-7c58-76b5-a2a9-c77140d8648c",
  "fieldPath": "sense.translations",
  "sourceType": "PROJECT_AUTHORED",
  "sourceName": "VocabFlow Hybrid 100-Sense Editorial Authoring",
  "authoredBy": "VocabFlow project",
  "notes": "Project-authored during the owner-reviewed hybrid 100-Sense proof; external APKG sources were used only as local semantic reference and their text was not reused.",
  "createdAt": "2026-10-04T14:45:42Z"
}
