{
  "provenanceId": "01a10760-b9f0-7a70-8b9e-8c6078553233",
  "subjectType": "CLASSIFICATION",
  "subjectId": "01a10760-b9f0-74c8-a07f-e1a5d8a94a1f",
  "fieldPath": "classification.valueCode",
  "sourceType": "PROJECT_AUTHORED",
  "sourceName": "VocabFlow Hybrid 100-Sense CEFR Editorial Review",
  "authoredBy": "VocabFlow project",
  "notes": "VocabFlow editorial CEFR estimate under CEFR/EDITORIAL-PILOT-1. External APKG labels were used only as local review evidence and are not represented as official or licensed classification claims.",
  "createdAt": "2026-10-04T14:45:42Z"
}
