{
  "provenanceId": "01a10760-b9f0-783d-8f56-efe8c42d79a5",
  "subjectType": "LINGUISTIC_CHILD",
  "subjectId": "01a1070c-7c58-76b5-a2a9-2283378efe69",
  "fieldPath": "sense.definitions",
  "sourceType": "PROJECT_AUTHORED",
  "sourceName": "VocabFlow Hybrid 100-Sense Editorial Authoring",
  "authoredBy": "VocabFlow project",
  "notes": "Project-authored during the owner-reviewed hybrid 100-Sense proof; external APKG sources were used only as local semantic reference and their text was not reused.",
  "createdAt": "2026-10-04T14:45:42Z"
}
