{
  "provenanceId": "01a0fc13-09f2-7a02-934d-0ca131db54f4",
  "subjectType": "CLASSIFICATION",
  "subjectId": "01a0fc13-09f2-7dd9-8168-217649f4bedf",
  "fieldPath": "classification",
  "sourceType": "PROJECT_AUTHORED",
  "sourceName": "VocabFlow Master Vocabulary V2 Phase 2B pilot",
  "authoredBy": "VocabFlow project",
  "notes": "Editorial audience suitability only; no hard age boundary is defined or asserted.",
  "createdAt": "2026-10-02T00:00:00Z"
}
