{
  "provenanceId": "01a0fc13-09f2-72ce-bbd9-91511c0ac0fe",
  "subjectType": "CLASSIFICATION",
  "subjectId": "01a0fc13-09f2-71a4-9a9b-0b8d5941bd35",
  "fieldPath": "classification",
  "sourceType": "PROJECT_AUTHORED",
  "sourceName": "VocabFlow Master Vocabulary V2 Phase 2B pilot",
  "authoredBy": "VocabFlow project",
  "notes": "Editorial audience suitability only; no hard age boundary is defined or asserted.",
  "createdAt": "2026-10-02T00:00:00Z"
}
