{
  "provenanceId": "01a10760-b9f0-7240-9744-93a913c2692b",
  "subjectType": "LINGUISTIC_CHILD",
  "subjectId": "01a1070c-7c57-7676-9ace-88be79559eff",
  "fieldPath": "example.exampleTranslations",
  "sourceType": "PROJECT_AUTHORED",
  "sourceName": "VocabFlow Hybrid 100-Sense Editorial Authoring",
  "authoredBy": "VocabFlow project",
  "notes": "Project-authored during the owner-reviewed hybrid 100-Sense proof; external APKG sources were used only as local semantic reference and their text was not reused.",
  "createdAt": "2026-10-04T14:45:42Z"
}
