{
  "provenanceId": "01a0fc13-09ee-7610-9a3d-25120a1f081f",
  "subjectType": "LINGUISTIC_CHILD",
  "subjectId": "01a0fc13-09ee-7a74-9750-0fd66f44963e",
  "fieldPath": "sense.definitions",
  "sourceType": "PROJECT_AUTHORED",
  "sourceName": "VocabFlow Master Vocabulary V2 Phase 2B pilot",
  "authoredBy": "VocabFlow project",
  "notes": "Project-authored learner-friendly definition; not copied from an external dictionary.",
  "createdAt": "2026-10-02T00:00:00Z"
}
